title,company,location,link,description
Data Engineering Intern / Coop,AutoMetrics Manufacturing Technologies Inc,"Markham, ON L3R 9Z7",https://ca.indeed.com/rc/clk?jk=dc273610c29a9a42&bb=wm_hp22aT4Vm9eBwP2O2IIvHQ0Rsn_6r1kWOWszGTGlB74gE7i-RMWF31fHpmJ_tOlBRVf746uAEruwfT_y76yC-vR7utyeTuNdUYhdgzJOox9CSCOoHotXT7dN0vYQ3&xkcb=SoAm67M3nQY2uvwrAh0LbzkdCdPP&fccid=0be6d13beb4f2244&cmp=Autometrics-Manufacturing-Technologies-Inc&ti=Data+Engineer&vjs=3,Not specified
HR Assistant Coop,HRX Connect,Remote,https://ca.indeed.com/rc/clk?jk=c7b5d113028ac388&bb=wm_hp22aT4Vm9eBwP2O2IFc3vpguANpv-PRNymWhp3wRs-9uCKD7d-0CO8r1S5bAnjxySH7pOyH2UtDhBcZbEXanKTdYYa21tBc1h-fWAScLK-QboYijklCuH3EawJNf&xkcb=SoCS67M3nQY2uvwrAh0KbzkdCdPP&fccid=5ac84e8f35a0f39b&vjs=3,Not specified
"Junior Accountant, Coop",North Horizon,"North York, ON M2J 4R3",https://ca.indeed.com/rc/clk?jk=b4b2325e82bb996b&bb=wm_hp22aT4Vm9eBwP2O2IH-SRsv4ZfgOl-jEKOkbvHKYN0pxjn7fQ3Vz_IlQMGK7Q-A4I_Q41_rmnbbJEaYJyh26zOpyv2SgWDq7XY1VPYarlZCoy3XyLt3wGzRL2CIL&xkcb=SoAP67M3nQY2uvwrAh0JbzkdCdPP&fccid=6d66b9d35ab3bc85&vjs=3,"North Horizon is a Canadian institutional investor with a global investment footprint. As a family office, we are dedicated to investing in people and innovative ideas that positively impact our communities, fostering lasting change for generations to come.
About the role: The Junior Accountant Co-op will have the opportunity to gain hands-on exposure to the full accounting cycle and assist the Senior Financial Analyst with recording business transactions and analyzing business performance.
Responsibilities:
Develop technical skills in areas such as bookkeeping, compilation, and audit
Summarize current financial status by collaborating with the team and preparing relevant documentation and reports on a monthly basis
Assist in all aspects of the monthly close process, including preparing and posting journal entries
Assist with tracking banking records and performing reconciliations, maintaining high-standard documentation related to various investments, including hedge funds, private equity, securities, bonds, etc.
Support data automation projects related to reconciliation, financial close, and reporting
Contribute to ad-hoc projects as required

What you need to succeed
Skills & Qualifications
3rd or 4th year student majoring in Accounting or another finance-related field
Advanced MS Office skills, with strong proficiency in Excel
Knowledge of Excel VBA or Python is considered an asset
Self-starter who proactively volunteers for new opportunities and projects
Ability to work toward and meet agreed deadlines
Excellent interpersonal and written communication skills
Fluency in both English and Chinese is considered an asset
Available to begin in the last week of April 2026, with an expected commitment of approximately 8 months
What’s in it for you?
At North Horizon, we are committed to building a great culture that cares, nurtures, and values every individual who works here. You will:
Work on real projects that directly impact the company and gain practical experience in your field of interest
Receive guidance from experienced professionals who are eager to support your development and help you build valuable industry knowledge·
Connect with professionals across various departments, gaining exposure to a broad network of contacts that can help shape your career path
Be part of a dynamic, high-performing team that thrives on challenges and continuous improvement
Work in a forward-thinking environment where creativity and new ideas are encouraged and supported"
AI Software Engineer Coop,HRX Connect,Remote,https://ca.indeed.com/rc/clk?jk=21ade84499da7a30&bb=wm_hp22aT4Vm9eBwP2O2IAaNSJ4zJQqUvUoHrEXpAUOcY69Kn-U7tCq5ZIP1FbTKpJL4PsdA1apq5gBnA3lNQGs4r6YOhD0TysLU_ftRFbnCuWT5kGOltiPk4tDisLkM&xkcb=SoC767M3nQY2uvwrAh0IbzkdCdPP&fccid=5ac84e8f35a0f39b&vjs=3,"Job Title: AI Software Engineer
Job Type: Full time Location: RemoteReporting to: CEO
CompanyHRXconnect is a Canadian HR consulting boutique specializing in People & Culture services and Talent Acquisition. We concentrate on startups, scaleups, and SMBs with ambitious growth objectives. Our solutions are customized, compliant, and designed for effortless scaling. With expertise in tech, digital marketing, sales, finance, and administration, we assist in constructing dynamic teams. Our aim is seamless integration with organizations, aligning our success with theirs.
About RoleThe AI Software Engineer will work on enhancing existing AI features that involve an NLP search engine and AI ranking. This role involves collaborating with senior consultants to create AI-driven solutions, analyzing data for actionable insights, and communicating results to stakeholders. The workload includes weekly meetings and contributing to deliverable timelines. You should be a final year student and strong NLP and AI experience is required along with high proficiency in Python, Django, FastAPI and React.
What You Will Do
Develop and optimize AI features.
Collaborate with senior consultants to understand business needs and craft AI-driven solutions aligned with company goals.
Analyze data and provide actionable insights to support business decisions.
Communicate technical results and business impact to stakeholders in a clear, concise manner.
Continuously research and implement best practices to improve AI models and keep up with advancements in the field.

Who You Are
Current final year student pursuing a degree in Computer Science, AI, or a related field
Strong understanding of LLMs, NLP, and hands-on experience with AI.
Proficiency in Python and experience with machine learning frameworks like TensorFlow, PyTorch, Transformers, React, Django and FastAPI.
Ability to apply AI techniques to solve complex business problems and create tangible value.
Excellent communication skills and the ability to collaborate effectively with cross-functional teams.
Experience with large-scale AI systems and real-world applications of NLP.
Knowledge of additional machine learning and AI technologies.
We believe diversity and inclusion is a strength we cultivate. We are proud to be an equal opportunity employer and we do not discriminate based on race, gender, ethnicity, citizenship, national origin, religion, sexual orientation, age, marital status, disability, veteran status, or any other legally protected status. Our work environment welcomes equity, inclusiveness, and diversity by providing accommodations throughout the recruitment process and during your employment here."
Quality Assurance Engineer,VertiGIS GmbH,"Victoria, BC V8W 1T7",https://ca.indeed.com/rc/clk?jk=c3655ddd95180262&bb=wm_hp22aT4Vm9eBwP2O2IAoUz32Rd4aN80-F62FyB7anZecyWY5cWx55qS6-OWbDmvL7FS3IN9BmAl6Tj5sgQvPR-3uoW5fqF1fGUrnKhR3ir9PYckInKis4K2VhrHzT&xkcb=SoA167M3nQY2uvwrAh0PbzkdCdPP&fccid=f2067f5c98e29faa&vjs=3,"The Company
At VertiGIS, we build powerful GIS software. Our portfolio of products, solutions, and services enhance the capabilities of leading mapping software, most notably Esri’s ArcGIS. For decades, professionals have relied upon us to overcome complex technical challenges so that they can make a significant impact in the world.
VertiGIS offers challenging and meaningful careers. Our employees help make a difference in the world through our technologies. We believe every individual contributes to a company’s culture through attitude, interests, and skills. Our teams are comprised of passionate, high-performing individuals that come from a diverse set of educational, cultural, and professional backgrounds. Together we strive to do great work, support each other in growth, and have fun!
The Position
Over 1,500 organizations around the world rely on VertiGIS to design, develop and maintain both web and mobile based mapping applications. We believe geographic information over the web and on mobile devices can empower people to make better decisions about their lives, society, and the world around us. You can help us make a difference.
This challenging position offers the opportunity to build new skills and gain experience with various VertiGIS Studio products on our Products team. Your abilities and interests will strongly influence the nature of this position at VertiGIS North America.
We welcome candidates at the junior, intermediate, or senior level, offering responsibilities and compensation that reflect experience.
Responsibilities:
Software product quality assurance, which may involve research and analysis, product testing, test case design, automated functional tests, defect reporting and verification, release testing, and managing test data
Designing and executing test plans for spatial applications and frameworks for the web and mobile devices that are developed by the Products Team
Working with a variety of development and quality assurance technologies and approaches including on-premises and SaaS deployment, back-end services, and front-end UI
Provide guidance and knowledge to other stakeholders within the company
Diploma/degree in computer science, software engineering, or equivalent competency Experience:
For Junior: previous exposure to software Quality Assurance Engineer tasks (e.g. as a coop student or study project work)
For Intermediate: 3+ years working experience in a software Quality Assurance Analyst/Engineer role
For Senior: 6+ years working experience in a software Quality Assurance Analyst/Engineer role
Experience in software programming, ideally in automated functional testing
Knowledge and experience with one or more of the following: JavaScript/TypeScript, React, C#, .NET
Proven ability to learn and master new technologies quickly
Experience with defect management software (Azure DevOps, JIRA, BugZilla, etc.)
Well-versed in software version control concepts and the software development life cycle
Familiar with Agile software development concepts
Demonstrable interpersonal and communication skills for success in a team environment
Capacity to work, troubleshoot, and solve problems independently
High level of accuracy, organization, and attention to detail
Would love to see:
Experience with GIS and/or spatial systems (Esri, raster/vector data, OGC, etc.)
Experience with UX driven development
Experience with WCAG and accessibility concepts
Experience with Cloud Computing frameworks (Azure, AWS, etc.)
Experience with application deployment frameworks (Containerization, Kubernetes, Docker, etc.)
Our Perks
Team / Career Growth
Top-notch colleagues that like and respect one another
We listen to peoples' ideas—and act on them
A supportive environment with opportunity for training, mentoring, professional development, and advancement
Challenging, interesting work
Cutting edge technology that improves the world around us
We're recognized experts in our field—people around the world seek us out
Benefits
Fair and equitable salaries, as well as profit sharing
A competitive group benefits program for you and your family
A health and lifestyle spending account
RRSP matching
4 weeks of vacation to start and 5 weeks of vacation after 5 years with the company
Maternity and parental leave top-ups
Bottomless book budget
Company summer and winter parties (that are fun to attend!)
Working Model
A choice between a hybrid or remote working model
A headquarters office in downtown Victoria with healthy snacks and good coffee
High-end hardware and equipment, in the office or at home
Secure bike storage and showers for those that bike to work
Lunchtime yoga on Tuesdays and Thursdays
At VertiGIS, we are committed to fostering a diverse, equitable, and inclusive workplace where everyone feels safe, respected, and valued. We encourage everyone who is interested in the role, regardless of race, ethnicity, religion, sex, gender, sexual orientation, disability status or age, to apply. Unique perspectives and experiences are what make our teams strong!

If you self-identify as having a disability, please let us know how we can best assist you. Accommodation is available upon request at any time during the recruitment process.
VertiGIS Compensation Philosophy
At VertiGIS, we strive to offer competitive total compensation packages that include both direct and non-direct compensation such as salary, health care and retirement benefits, variable/incentive pay, paid time off, and other benefits and perks.

Our job postings reflect the expected pay or pay range for each position in alignment with our compensation philosophy and salary budget. This reflects what we feel is competitive based on the profile of candidate we are seeking. The background, experience, and skill set we are seeking will be outlined in the role requirements.

We strive to have a comprehensive approach to compensation and ensure that employees are paid based on the value they bring to the company.
We’re a great place to build your career.
Our colleagues are great people and make our company the kind of place we enjoy coming to every day. We reward top performers and stay true to our core values. Since 1999, we’ve built our business based on steady, sustainable growth – we’re still growing and our future is bright!
Note: To avoid potential formatting issues, we require that you submit your resume and cover letter as PDF files.
Note: We use a recruitment tool to reach out to candidates so please check your inbox to ensure our emails are not being filtered as ""Social"" or ""Promotions"" (our provider has been notified)."
Business Support – Coop,CORPORATION OF THE TOWNSHIP OF WELLINGTON NORTH,"Kenilworth, ON",https://ca.indeed.com/rc/clk?jk=ca3551b42fcd8d03&bb=wm_hp22aT4Vm9eBwP2O2IHom1Uz7yNn2FHoQwG7Q3HqHS3OxNOM0VTERaGV-ddvlEVJ2yLD6c7eNAgqWRShCQ-LFse8rJF4rTfweabk8uaYKNAP6r5r-6cL3fxTSmLCM&xkcb=SoCB67M3nQY2uvwrAh0ObzkdCdPP&fccid=373263a714d15179&vjs=3,"Join the Township of Wellington North as a Business Support – Coop, on a Seasonal Fixed Term Coop Contract, that will work from approximately May until end of August 2026.
Why You’ll Love Working With Us:
Be part of a community-focused team.
Gain valuable, real-world experience.
Build customer service and communication skills.
Learn how municipal government operates.
Work in a Township that values: Community, Accountability, Respect, Engagement and Sustainability.
What You’ll Do:
Greet and assist visitors at the Municipal Office and serve as a friendly first point of contact
Answer phone calls and respond to email inquiries, providing information on municipal services
Direct inquiries to the appropriate department or staff member
Support facility rentals, program scheduling, and payment processing
Perform general administrative tasks such as data entry, filing, scanning, and document organization
Assist with meeting scheduling, set-up, and preparation
Draft correspondence, forms, and content for the website and social media
Conduct research, support special projects, and assist with day-to-day office operations
Contribute ideas to improve administrative processes and support team efficiency
What We’re Looking For:
Are currently enrolled in a College or University program (Business, Finance, Accounting, Office Administration, or related fields are an asset)
Are comfortable using Microsoft Office (Word, Excel, Outlook, PowerPoint)
Have strong communication skills (written and verbal)
Are friendly, professional, and enjoy working with the public
Can stay organized and juggle multiple tasks
Work well both independently and as part of a team
Position Details:
This is a Seasonal Fixed Term Coop Contract position, that works between 35 hours per week.
Typical schedule will be Monday to Friday anywhere from 8:30am to 4:30pm; working out of our Kenilworth Office.
Pay: $17.60 per hour
Apply Today!
Interested? Apply and spend your summer learning, growing and making a difference, right at the heart of the Township. Interested applicants should visit our Careers section and apply online at www.wellington-north.com.
Applications will be accepted in confidence until 12:00 PM February 2, 2026.
We thank all applicants for their interest. Only those applicants selected for further consideration will be contacted. Wellington North is an equal opportunity employer. Accommodation for disabilities will be provided, upon request, to support participation in all aspects of the recruitment process. Personal information in relation to the recruitment and hiring process is collected under the authority outlined in the Municipal Freedom of Information and Protection of Privacy Act."
General Ledger Accountant,FirstService Residential,"Mississauga, ON L4W 4H2",https://ca.indeed.com/pagead/clk?mo=r&ad=-6NYlbfkN0AarhfFjK6ZRvglElFSGpWqIZDMUS4BbBiVj3x-iGfCe68E3VzFuY9xH4O7uqPtJDErJKeSAi298ix3HAUE25XVrkGxxmFlGDvXs3F5ovqXzMl0RXQuCL_SdZiyngFu0TnBOMzhwH5Xr9y4LISN_jIXezLij2YW-U69rNJKpSutVCl4emHE9PqvS4BPdtIfK72ApyMcvLLqfOWSrsRt1zDk4QiPohWyyC6zvHGJMgV3Tl1vHKThHeFs6u-KzHuAo_ZrmTkBCSvDlltM8iAXn3jvx3qtJZoAKevxSZlYlQ3HegobYyubrp-oCndE_1r8qnBuAUCSgT5bzPoADeNVsdij51YG7Tyhr95M1nsKJIpamFNZgSU8EKKeWj5FgOYNGldV4wfiPuOmLPlYfQBe3je9mDycNzNVstc77qc5iLts5UHrArv2WFFfwQMNZ_T49Kmt1VdMWnvnxleWjof8U-q4JO5HgNpIiWGFFLVOjY3jcpYBtVIOI-mf7IBl_qwDPufs-TrqPIdF_VnO0h5SdutSVaO2rZJLLyRTxFyT0lzJg2kE3KVbwcWR4hk_Pe7OH5Bx5aFKrpxplGLYqrx-JNugnTMg85SvTa8fg9-HCX8D7i6qbaXeqvAoGySjj0r4CkMzlwBn_ij7wik-f09lCTVfbAAhDj-ednIgtboYtKNUvKuo4_QAK5rxZ60J8_-keP6VMRT_t8KKKVa0F77036TECmS3_vGdRfM=&xkcb=SoDo6_M3nQY2uvwrAh0NbzkdCdPP&camk=G42KULXkIwN2iuw_yK_eDg==&p=6&fvj=0&vjs=3,"Description

General Ledger Accountant
FirstService Residential is owned by FirstService Corporation, a proudly Canadian company and one of Canada’s great business success stories.
FirstService Residential transforms the property management landscape by providing professional association management services to over 9,000 residential communities across the United States and Canada.

Our dedication to associate satisfaction and growth is recognized by our Great Place to Work certification, exemplifying our commitment to fostering a positive and inclusive workplace culture. Our 19,000 associates can count on competitive salaries, top-tier medical, dental, and retirement benefits, career training, and support for continued professional development.

Experience exceptional service with a fulfilling career in property management with FirstService Residential.

Why choose Us
We offer a hybrid working environment with flexible hours and the option for a modified 4.5 day work week. We have a comprehensive benefits program inclusive of a Health Spending Account, Workperks, and more! Most importantly, we are committed to empowering, developing and supporting all our associates.

Overall, this role will be responsible for the accounting of a portfolio of condominiums and/or cooperatives in New York City. Must have the ability and eagerness to not only produce monthly financial reports but to prepare multiple financial budgets. This position will be constantly required to hit deadlines for the appropriate assigned projects. The key function of this job is to review all the support team’s input into the financial statement process and make sure that everyone has completed their roles according to expectations. Then this role will complete the financial statement process and be submitted to the Property Manager for final review. This position will be a key support for the day-to-day accounting support for the Property Managers and Board members. Must be a quick learner, able to multi-task and manage time effectively. This person will be the conductor for all the varies support teams in creating accurate and timely financial statements.

Essential Duties & Responsibilities

The job duties listed are typical examples of the work performed by positions in this job classification. Not all duties assigned to every position are included, nor is it expected that all positions will be assigned every duty.
The position is hybrid; employee must be able to work in an FSR office.
Prepare monthly bank reconciliations for the assigned portfolio of buildings which includes all buildings’ reserve accounts to clear any outstanding items that the bank reconciliation team did not clear.
Prepare monthly financial packages which includes a table of contents
Analyze and communicate the actual to budget variances
Attend meetings with clients as needed, to explain financials
Participate in annual budget preparation for the assigned portfolio of buildings by the assigned deadline dates
Resolve internal client inquiries submitted via ticketing system, Zendesk


Perform the necessary month-end duties such as:
Initiate/schedule transfers, which includes escrow transfers, reserve contributions, assessment billing, reserve funding and non-operating revenue transfers to reserves, etc., segregating funds appropriately.
Maintain and update accurate accounting of the liability accounts such as security deposits.
Complete special projects for both internal and external, as assigned.


Perform the necessary year-end duties such as:
Year-end close on each of the buildings’ financial chart of accounts include the annual reports in year-end financials.
Participate in the annual audit process for the entire portfolio including accommodating the auditor’s needs and requests in a timely manner.
Reallocate the month-to-month budget spread for the financial reports.


Education & Experience
Bachelor’s degree in accounting or finance from a four-year college or university.
5+ years of experience as an Accountant in the property management Condo/Coop industry or is required.
Condominium CAM Allocation and New Development knowledge/experience is preferred
Preferred: CPA certification, MBA or related work experience.


Knowledge, Skills & Proficiencies
To perform this job successfully, an individual must be able to perform each essential duty satisfactorily. The requirements listed below are representative of the knowledge, skill and/or ability required.
Knowledge of assets, cash balance, and availability of funds for projects and cash flow management for capital improvements.
Excellent organization, motivation, leadership, time management and interpersonal skills.
Critical thinking, complex problem solving, judgment and decision-making ability.
Strong verbal, presentation, and written communication skills. Ability to communicate and provide guidance to all client levels
Must have strong proficiency in Windows and Microsoft Office, including but not limited to Word, Excel, Power Point and Outlook. Proficiency researching the Internet.
Previous experience with financial and accounting programs such as Yardi and MDS is a plus.
Must be able to keep up in a fast-paced, ever-changing environment while maintaining a cool, calm, and collected attitude
Ability to work well in a team environment as well as independently.
Must be self-driven with the ability to identify, plan and prioritize projects and assignments and be able to hit important deadlines
Knowledge of mechanical operations of a building and equipment preferred.


Compensation
Compensation for this role is between $85 – 95,000 + benefits.

Disclaimer
The above information on this description has been designed to indicate the general nature and level of work performed by employees within this classification. It is not designed to contain or be interpreted as a comprehensive inventory of all duties, responsibilities, and qualifications required of employees assigned to this job. This is not an all-inclusive job description; therefore, management has the right to assign or reassign schedules, duties and responsibilities to this job at any time.
FirstService Residential is an equal opportunity employer committed to a diverse and inclusive workforce. Applicants will receive consideration for employment without regard to race, colour, religion, sex (including pregnancy), age, sexual orientation, national origin, marital status, parental status, ancestry, disability, gender identity, veteran status, genetic information, other distinguishing characteristics of diversity and inclusion, or any other protected status.
FirstService Residential welcomes and encourages applications from people with disabilities. Accommodations are available upon request for candidates taking part in all aspects of the hiring and selection process.

Our hiring process may use AI screening for keywords and minimum qualifications. Talent Acquisition Specialists review all results.

In accordance with Ontario’s Employment Standards Act (ESA) requirements, we confirm that this job posting is for an existing position within our organization.

INDHON

Automated Employment Decision Tool (AEDT) Usage: We may utilize an Automated Employment Decision Tool (AEDT) in connection with the assessment or evaluation of candidates. The AEDT is designed to assist in objectively evaluating candidate qualifications based on specific job-related characteristics.

Job Qualifications and Characteristics Assessed: The AEDT evaluates candidates based on job qualifications and characteristics pertinent to the role, including skills, experience, and competencies relevant to the position requirements. These qualifications are determined by the unique needs of each role within our company.

Alternative Selection Process or Reasonable Accommodations: Candidates who require an alternative selection process or a “reasonable accommodation,” as defined under applicable disability laws, may make a request through our designated contact channel national_recruiting@fsresidential.com.

Requesting Information About the AEDT - NYC Local Law 144: Candidates who reside in New York City and are subject to NYC Local Law 144 may request information about the AEDT, including details on the type of data collected, the sources of such data, and our data retention policies. To submit a request, please contact us at national_recruiting@fsresidential.com; we will respond in accordance with Local Law 144, within 30 days."
