title,company,location,link,description
Structural Engineer-in-Training (EIT) - New Graduate,Hatch,"Vancouver, BC V6E 3X2",https://ca.indeed.com/rc/clk?jk=7302868da256dfd8&bb=oVYnPVy4rfkhE_5pQbnmQoShxpP-LCjdCD1CNnUKH35wtxB94apxRef8T5KdXN1Z3HZts1ewft3Ii1bUFtdQkRl6ijSUNvaE6p41dbVtAmm0Q6vS0LrriZSa7vWasKvH&xkcb=SoBP67M3nQZDpbRSoh0DbzkdCdPP&fccid=271f4b71c532dd4b&vjs=3,"Requisition ID: 97539
Job Category: Campus
Location: Vancouver, BC, Canada

Join a company that is passionately committed to the pursuit of a better world through positive change. With more than 65 years of business and technical expertise in mining, energy, and infrastructure, our 10,000 colleagues in 150 countries tirelessly work toward bettering the industries in which we operate. With practical solutions that are safe, innovative and sustainable, we think globally while acting locally.

Join our Project Delivery Group (PDG), a dynamic team of professionals passionately committed to world-class project delivery across the globe. With expertise in sustainable studies, asset building and operations, and industry-leading efficiencies, our best-in-class team leverages methodologies, governance and systems that are unparalleled in the engineering space. Are you looking for an opportunity to join a diverse group of professionals who are committed to remaining exceptional? We look forward to hearing from you.

Looking to take the next step in your career?

The PDG group at Hatch is seeking a Structural Engineer-in-Training (EIT), new graduate with interest in structural analysis and design of heavy industrial building and equipment structures and foundation systems. Reporting to the Structural Discipline Lead Engineer you will support projects globally working from the Vancouver office.
What a Career at Hatch Will Offer You:

You will:
Be given opportunities to contribute to complex projects around the world in meaningful ways
Work on challenging projects and problems and gain experience in the office and on project sites
Collaborate with diverse teams locally and globally
Work in an exciting environment where you can apply your academic learning daily
Gain relevant experience and support in obtaining your professional designation
Benefit from formal and informal mentorship from some of the leading minds and authorities in the industry
Participate in local Professional Development Programs, Sustainability Week, Toastmasters, and more to develop your skills
Join in charitable, social, and sports activities with other Hatch employees

We are entrepreneurs with a technical soul. Our flat organizational structure creates an atmosphere of openness and participation. We build practical solutions that are safe, innovative, and sustainable. Our goal is to achieve no harm for our people, our clients, and our communities.

Responsibilities:
Work independently to apply engineering principles to perform calculations for structural analysis and design of industrial building and equipment support structures and foundations
Work collaboratively to share the results of your work with senior members of the discipline and / or other Hatch groups
Prepare calculation reports to support the results of your analysis and design, to be checked by senior colleagues and used to support engineering documents to be used by internal and external stakeholders
Become knowledgeable of structural analytical software and tools, building codes and material design codes, discipline workflows and execution, process building and equipment structure and foundation systems, and other industrial components / processes you are assigned to assess
Participate in office and site safety training and inductions as needed to support office and site activities
Willingness and ability to travel and work in other Hatch offices or project work sites (including remote sites) as needs and opportunities arise

Education and Experience:
Must be working towards graduating in 2026, or recently graduated, with a bachelor’s degree in Civil Engineering with specialization in Structural Engineering or Master’s Degree in Structural Engineering
Excel academically while being actively involved in extra-curricular and/or volunteer activities at school or in the community
Preferred academic courses include Structural Analysis, Structural Mechanics, Reinforced Concrete Design, Structural Steel Design, Foundation Design
Preferred advanced courses include Structural Dynamics, Finite Element Analysis, Seismic Design
Previous relevant coop and summer work terms or internships in structural engineering is an asset
Academic or work experience with structural software SAP2000 and/or STAADPro, MathCAD, and Bentley MicroStation CAD software is an asset

Competencies (knowledge, skill, attributes):
Good understanding of engineering and business fundamentals as they apply to engineering problems and projects
Ability to learn quickly and to take on new challenges
Collaborative team player with excellent interpersonal skills
Excellent organizational skills and attention to detail
Strong written and verbal communication skills
Shows critical and creative thinking and problem solving, and brings forward solutions for our clients' toughest challenges
Adapts and embraces change

Compensation:
Range: $81,000 - $84,000

At Hatch, we are committed to fair and equitable compensation practices. In accordance with legislated pay transparency requirements, the expected salary range for this position is based on current market data and aligned with internal pay structures to ensure consistency and fairness.

Your individual compensation within this range will depend on factors such as skills, experience, qualifications and location. In addition to base pay, our total rewards package may include performance-based incentives, comprehensive benefits, and other programs designed to support your well-being and growth.

Note: Applicants must submit a transcript (official or unofficial) upon application.

Why join us?
Work with great people to make a difference
Collaborate on exciting projects to develop innovative solutions
Top employer

What we offer you?

Flexible work environment
Long term career development
Think globally, work locally

Don't meet every single requirement? You don't need to. At Hatch, we are building a diverse, inclusive workplace that fosters innovation. If you're interested in this role, we encourage you to apply even if your past experiences don't perfectly align with the skills we've listed.

We're committed to fostering a workforce that reflects the diversity of the communities in which we operate and serve. Hatch is an Equal Opportunity Employer that considers applicants without regard to age, race, color, national origin, citizenship, religion, creed, gender, sexual orientation, marital status, disability, veteran, or any other protected status. If you have any accommodation requirements, please let us know. We'll do our best to meet your needs in accordance with applicable local legislation.
[[req_postHashtag]]"
"Talent Acquisition Lead, Campus",Hatch,"Mississauga, ON",https://ca.indeed.com/rc/clk?jk=c3c43070146054dc&bb=oVYnPVy4rfkhE_5pQbnmQhyiAXXPPoRyWmt_ZhKink00oyAE_6InnDfYmwr0_YT1O7aPLyGFttfPZ_yi9Tna8jLMYt32hrJ1Z0UCbJZ9lSAUwmCK7oxnFwbSIqkPad8t&xkcb=SoD767M3nQZDpbRSoh0CbzkdCdPP&fccid=271f4b71c532dd4b&vjs=3,"Requisition ID: 97738
Job Category: Human Resources
Location: Mississauga, ON, Canada

Join a company that is passionately committed to the pursuit of a better world through positive change. With more than 65 years of business and technical expertise in mining, energy, and infrastructure, our 10,000 colleagues in 150 countries tirelessly work toward bettering the industries in which we operate. With practical solutions that are safe, innovative and sustainable, we think globally while acting locally. Are you looking for an opportunity to join a diverse group of professionals who are committed to remaining exceptional? We look forward to hearing from you.

As part of our Shared Services group, comprised of Finance, Marketing, Communications, Human Resources, Commercial, Legal and Facilities, we support the business achieve their goals through a range of strong technical capabilities. We ensure delivery of services through the skills of our people, methodologies, and systems.

Looking to take the next step in your career? Hatch is currently seeking a highly motivated Campus Talent Acquisition Senior Manager, North America to join our team.

Reporting to the Global Head of Campus Talent Acquisition, the Campus Talent Acquisition, Senior Manager will oversee all aspects of our North American Campus strategy to attract the best and the brightest talent to the organization. The role will enable the attraction of diverse talent and develop talent pipelines for Hatch through coops, internships and new graduate opportunities. In this role, you will be based in our global head office in Mississauga.

Join our team and become part of a community that strives for positive change.

As the successful candidate, you will:

Execute the campus strategy, providing high volume full-cycle recruiting support across Canada (Western Canada/Eastern Canada) and the United States through the Campus Talent Acquisition Specialists
Oversee the day-to-day recruitment operations of 4 Campus Talent Acquisition Specialists
Serve as the primary point of contact for educational institutions and the business
Plan and participate in campus events including Career Fairs, Information Sessions, Case competitions, Classroom presentations, and Conferences
Act as a trusted advisor and work closely with internal stakeholders to establish a tailored recruiting approach at designated school(s) to achieve skills requirements
Serve as a “Brand Ambassador” to expand our external footprint to build the Hatch Brand through social media and other channels
Execution of Student and New Grad Engagement model to enhance employee experience
Assess sponsorship requests and determine level of engagement
Manage scholarship programs
Provide reporting on campus analytics

You bring to the role:

6-10 years of full cycle, high-volume campus recruitment experience; preferably for engineering or technical students and graduates
3-5 years of experience leading small to mid-sized teams preferably in campus recruitment
Current knowledge and understanding of best practices including effective approaches to attraction, recruitment and selection in the Campus recruitment space
College or university degree in Human Resources, or related field preferred
Proven ability to manage high volume campus recruitment in a fast-paced and deadline-driven environment
A continuous improvement mindset, always striving to improve the candidate, client and recruiter experience
Experience defining and tracking success and KPIs on campus program initiatives
Able to handle and manage conflicting priorities with high attention to detail, accuracy, follow-up and follow-through skills
Strong business acumen and understanding of key business drivers
Exceptional communication skills with the ability to build relationships and rapport quickly and deliver outstanding internal and external service
Ability to think and act both strategically and tactically: see, understand, and support the big picture, while also executing specifics on the ground alongside the team
A demonstrated commitment to valuing differences and working alongside and/or coaching diverse people and perspectives

Base salary range: $71,000 - $121,000

At Hatch, we are committed to fair and equitable compensation practices. In accordance with legislated pay transparency requirements, the expected salary range for this position is based on current market data and aligned with internal pay structures to ensure consistency and fairness.

Your individual compensation within this range will depend on factors such as skills, experience, qualifications and location. In addition to base pay, our total rewards package may include performance-basedincentives, comprehensive benefits, and other programs designed to support your well-being and growth.

Why join us?
Work with great people to make a difference
Collaborate on exciting projects to develop innovative solutions
Top employer

What we offer you?

Flexible work environment
Long term career development
Think globally, work locally

Don't meet every single requirement? You don't need to. At Hatch, we are building a diverse, inclusive workplace that fosters innovation. If you're interested in this role, we encourage you to apply even if your past experiences don't perfectly align with the skills we've listed.

We're committed to fostering a workforce that reflects the diversity of the communities in which we operate and serve. Hatch is an Equal Opportunity Employer that considers applicants without regard to age, race, color, national origin, citizenship, religion, creed, gender, sexual orientation, marital status, disability, veteran, or any other protected status. If you have any accommodation requirements, please let us know. We'll do our best to meet your needs in accordance with applicable local legislation."
Engineering Community COOP *11-months fixed term,Thales,"Ottawa, ON K2E 7M6",https://ca.indeed.com/rc/clk?jk=532f6237c7b2751c&bb=oVYnPVy4rfkhE_5pQbnmQgWcWkgdIuI1vQ6Y-tX_MIdnMe2i7F2mAeYr_4LNhmbY-8OIxStL1q2AQlaBRp-rp_oh0L2yKEmtuhFMaB0lk2pzPBeSMzJn7FVoz4CHJrOe&xkcb=SoBm67M3nQZDpbRSoh0BbzkdCdPP&fccid=b920aab5fd60595d&vjs=3,"Location: Ottawa 20 Colonnade, Canada
In fast changing markets, customers worldwide rely on Thales. Thales is a business where brilliant people from all over the world come together to share ideas and inspire each other. In aerospace, transportation, defence, security and space, our architects design innovative solutions that make our tomorrow's possible.
This is a Hybrid fixed term COOP role in Ottawa, ON and role can be hired in Quebec or Vancouver, BC or Halifax, NS.

Position Summary
We have a current vacancy for an Engineering Community COOP to join our Team in Ontario, Canada.

Thales Corporate Engineering in the Americas is looking for a COOP/apprentice to support the Engineering communities. You will support the Engineering Director to build an Engineering community across the Americas that is greater than the sum of its parts. This will be done by connecting with the broader Thales Engineering community, supporting the organization of collaborative events, expanding the use of digital and non-digital communication and helping building operational dashboards to support regional activities.

Key Areas of Responsibility
WHAT COULD WE ACCOMPLISH TOGETHER?
If you are interested in building communities, Engineering and digital culture you can help the Americas Engineering Director by:
Helping with seminars and webinars to create a sense of belonging of the Engineering community
Helping spread awareness about Engineering craftsmanship, digital culture, learning in Engineering by connecting to the greater Thales and through digital tools such as SharePoint
Finding and helping create engaging digital content on Engineering in the Americas leveraging on what exists at group level, and also in the industry in the Americas
Researching and analyzing ideas from external Digital Transformation and Engineering events and proposing ways in which Thales can benefit from them.
Work closely with the entire Digital Communication team to share expertise, develop joint projects, and propose the best interfacing between the Digital Communication services.
Support the digitization of data for Engineering and the build the dashboard that will help the decisions makers
Basic Qualifications
WHO ARE YOU?
You are in your last year of study in a Business School or Engineering school with a strong interest for communication or equivalent
You thrive on connecting with others and enjoy building engaged communities
You have a high interest in Engineering and Digital transformation
You are a curious and self-motivated individual who enjoys learning
You have excellent communication skills
You are fluent in English and have knowledge of French and Spanish
You have knowledge in data analysis and visualization using tools such as PowerBI

Other skills/experience that are a preference,
You have a degree in Engineering
You are fluent in French and Spanish
You have knowledge of Portuguese
Special Position Requirements

Schedule: Core Business Hours: Monday-Friday

Travel: Some travels would be required within the Americas

Why Choose Us?

‍ STEM Commitment
Thales prioritizes advancing STEM education. We provide co-op students with extensive hands-on experience in science, technology, engineering, and mathematics, crucial for our collective success.

‍ Dedication to Non-Profit STEM Initiatives
Through partnerships and programs like Technovation and the Canadian Industrial Leadership Award (CILA) for female students, we foster the next generation of STEM leaders.

️ Solidarity Program
Our global commitment to supporting non-profit STEM projects encourages employees to contribute their skills and time to vital causes.
Why Join Us?
Say HI and learn more about working at Thales click here.
#hybrid
#LI-WM1
The reference Total Target Compensation(TTC) market range for this position, inclusive of annual base salary and the variable compensation target, is between Total Target Cash (TTC) 64,560.80 – 80,701.00 CAD Annual.

This reflects how companies in a similar industry and geographic region generally pay for similar jobs. This range helps the Company make pay decisions as one data point among many. Where a position falls within this range is also dependent on other factors including – but not limited to – the employee’s career path history, competencies, skills and performance, as well as the company’s annual salary budget, the customer’s program requirements, and the company’s internal equity. Thales may offer additional benefits and other compensation, depending on circumstances not related to an applicant’s status protected by local, state, or federal law.

We use artificial intelligence–enabled tools as part of our recruitment process to support activities such as candidate discovery, résumé matching, and interview scheduling. These tools may help screen and assess applications and recommend potential matches based on the requirements within the job description. All hiring decisions, including candidate evaluation, selection, and disposition, are made by human recruiters. Artificial intelligence does not make hiring decisions on our behalf.
Thales provides an extensive benefits program for all full-time employees working 24 or more hours per week and their eligible dependents, including the following:
Company paid Extended Health, Dental, HSA, Life, AD&D, Short-term Disability, Cancer Care Program, travel insurance, Employee Assistance Plan and Well-Being program.
Retirement Savings Plans (RRSP, DCPP, TFSA) with a company contribution and a match to a DCPP, with no vesting period.
Company paid holidays, vacation days, and paid sick leave.
Voluntary Life, AD&D, Critical Illness, Long-Term Disability.
Employee Discounts on home, auto, and gym membership.
Thales is an equal opportunity employer which values diversity and inclusivity in the workplace. Thales is committed to providing accommodations in all parts of the interview process. Applicants selected for an interview who require accommodation are asked to advise accordingly upon the invitation for an interview. We will work with you to meet your needs. All accommodation information provided will be treated as confidential and used only for the purpose of providing an accessible candidate experience."
