title,company,location,link,description
Geotechnical Engineering Intern,AECOM,"Winnipeg, MB",https://ca.indeed.com/rc/clk?jk=7294673723b51092&bb=lCZQMjBWQa_JJl2FE87EeX1Ma4a3RdEv78poowGZxkmplzjpmvYv1axuguczbAweFUpH2Qi8oqL8w_Oe3eOxyMEd4UUv4uBOUsxIMPhdR2cI74z41tt2zfWBtjzwzjut&xkcb=SoD967M3nQZGiNwrAh0PbzkdCdPP&fccid=bafa4b35e9cd20ce&vjs=3,"Company Description

Work with Us. Change the World.
At AECOM, we're delivering a better world. Whether improving your commute, keeping the lights on, providing access to clean water, or transforming skylines, our work helps people and communities thrive. We are the world's trusted infrastructure consulting firm, partnering with clients to solve the world’s most complex challenges and build legacies for future generations.
There has never been a better time to be at AECOM. With accelerating infrastructure investment worldwide, our services are in great demand. We invite you to bring your bold ideas and big dreams and become part of a global team of over 50,000 planners, designers, engineers, scientists, digital innovators, program and construction managers and other professionals delivering projects that create a positive and tangible impact around the world.
We're one global team driven by our common purpose to deliver a better world. Join us.

Job Description

AECOM is seeking an energetic Geotechnical Engineering Intern for a 3-month term starting in May to August 2025. This position is based out in Winnipeg, Manitoba.
The responsibilities of this position include, but are not limited to:
Compile and present geotechnical data for project teams.
Assist with engineering design tasks using geotechnical software.
Process instrumentation data and perform calculations to support design decisions.
Support field investigations, including borehole drilling, instrumentation installation, and construction supervision.
Assist project team during the proposal/bid phase.
Communicate effectively with others within the team and with internal and external clients.
Perform work in accordance with projected budget and schedule under supervision.
Support the soil laboratory testing (Atterberg limits, Sieve, Hydrometer (PSA), etc.).
Prepare reports of laboratory test results.
Be able to learn and operate a nuclear field densometer.

Qualifications

Minimum Requirements:
Candidates must be currently enrolled in a university or college program in Civil or Geological Engineering with emphasis in Geotechnical Engineering and must have completed at least 1 years of study. Candidates who have recently graduated with a bachelor’s degree and plan to continue with the master’s degree are eligible to apply for this position. Recent graduates must have been enrolled in their bachelor’s degree in the most previous school term with an interest in pursuing an advanced degree in the same or similar discipline at the conclusion of the internship.
Preferred Qualifications:
Capable of using Microsoft office software (excel, Word, PowerPoint, Project)
Coop terms of construction administration, or related experience within the civil, geological or geotechnical engineering field.
Willing and interested in working overtime and weekends.
Comfortable working in both office and field settings.
Willing and interested in working for extended periods of time in northern Manitoba.
Perform work safely and effectively. Passion for safety, with the ability to help us ensure that nobody gets hurt.
Understand and follow oral and written instructions, including warning signs, equipment use, and other policies.
Valid and unrestricted driver's license.
Good written communication, time management and organizational skills.
Demonstrated interpersonal skills; conduct yourself with ethics and integrity, work within multi-disciplined teams, deal with complex issues, and maintain effective working relationships.
Have a high level of initiative and enthusiasm for getting things done.

Additional Information
Relocation is not available for this position.
Sponsorship is not available for this position
About AECOM
AECOM is proud to offer comprehensive benefits to meet the diverse needs of our employees. Depending on your employment status, AECOM benefits may include medical, dental, vision, life, AD&D, disability benefits, paid time off, leaves of absences, voluntary benefits, perks, flexible work options, well-being resources, employee assistance program, business travel insurance, service recognition awards, retirement savings plan, and employee stock purchase plan.
AECOM is the global infrastructure leader, committed to delivering a better world. As a trusted professional services firm powered by deep technical abilities, we solve our clients’ complex challenges in water, environment, energy, transportation and buildings. Our teams partner with public- and private-sector clients to create innovative, sustainable and resilient solutions throughout the project lifecycle – from advisory, planning, design and engineering to program and construction management. AECOM is a Fortune 500 firm that had revenue of $16.1 billion in fiscal year 2024. Learn more at aecom.com.
What makes AECOM a great place to work
You will be part of a global team that champions your growth and career ambitions. Work on groundbreaking projects - both in your local community and on a global scale - that are transforming our industry and shaping the future. With cutting-edge technology and a network of experts, you’ll have the resources to make a real impact. Our award-winning training and development programs are designed to expand your technical expertise and leadership skills, helping you build the career you’ve always envisioned. Here, you’ll find a welcoming workplace built on respect, collaboration and community - where you have the freedom to grow in a world of opportunity.
As an Equal Opportunity Employer, we believe in your potential and are here to help you achieve it. All your information will be kept confidential according to EEO guidelines. Artificial intelligence will be used to support the screening, assessment, and selection of applicants for this role. Final hiring decisions are made by the hiring team."
Gestion de la circulation aérienne en matière de produits de tour – étudiant coop,NAV Canada,"Ottawa, ON K1P 5L6",https://ca.indeed.com/rc/clk?jk=a59da1641d94234c&bb=lCZQMjBWQa_JJl2FE87EeW8F8z0gjJn1eAiccwWPhyU9ptBVV76fHIO_vw67-ra7DTlrXEY3bwGoFoF_Cu6Qcy4cskDDeu1SFeco7Nr5ureDL8p2b-Lxu8hiu8a42RwQ&xkcb=SoBJ67M3nQZGiNwrAh0ObzkdCdPP&fccid=d7901848f773490a&vjs=3,"Titre du poste
Gestion de la circulation aérienne en matière de produits de tour – étudiant coop
Catégorie d'emploi
Employé(e) en formation/étudiant(e)
Exigence linguistique
English / Anglais
Type d'accord de travail flexible
On site / Sur place
Date de fin de recrutement
2026-02-09
Niveau
STU-1
Échelle salariale
Commensurate with Experience / Selon l’expérience
Sommaire du poste
NAV CANADA is the world’s second largest Air Navigation Service Provider. We are a private company that operates mission critical systems that are fundamental to the safe and efficient service that manage 12 million aircraft movements a year.
As a member of the Air Traffic Management Team; the ATM Engineering Student will be involved in new and ongoing development and engineering support of Air Traffic Control systems.
You will have a diverse set of responsibilities which can include develop/enhance software, data analysis, system and software testing.
In this work term, the primary task for the student will be able to work individually and within a Scale Agile Framework (SAFe) Team on refactoring our Radar Software, and the Control and Monitoring Program.
Description d'emploi
Why Us:
Get real experience in programing, and system engineering.
Learn to use code change management, requirements management, code review and testing tools.
Learn to the different aspects of working in a Scaled Agile Framework.
Get hands on experience with system deployment and testing.
Programs and Level:
Students working towards a degree in Engineering, specializing in
Electrical, Computer, Software or similar disciplines.
Eligible for COOP in Summer 2026 as part of your program
Responsibilities
Software development (C/C++/Python/JavaScript) and testing.
System Hardware installation, setup and testing.
Create test plans, procedures and scripts.
Support life cycle support activities of current systems and lab
environments.
Desired Skills
Good understanding of programming.
Good understanding of operating systems.
Good understanding of Networking.
Good oral and written communications.
Ability to work independently and in a team environment.
Working Conditions:
This is a 5 days a week onsite role at the Technical Services Centre,
280 Hunt Club Road, Ottawa, ON
NAV CANADA s’engage à se doter d’un effectif compétent qui reflète la diversité de la population canadienne. N’hésitez pas à postuler même si vous ne pensez pas répondre à tous les critères ci-énoncés. En effet, NAV CANADA préconise une culture d’apprentissage et de développement, et est consciente que si certaines compétences techniques sont essentielles, beaucoup d’autres peuvent s’apprendre.
La Société s’efforce de créer un processus de sélection et des milieux de travail inclusifs et sans entraves. Si vous avez besoin de mesures d’adaptation dans le cadre du concours, n’oubliez pas de mentionner lesquelles au coordonnateur ou à la coordonnatrice de l’entrevue ou au ou à la gestionnaire responsable de l’embauche. NAV CANADA fournira aux candidates et aux candidats handicapés les mesures d’adaptation nécessaires tout au long du processus de recrutement et de sélection.
La personne retenue doit satisfaire aux exigences de sécurité du poste et être légalement autorisée à travailler au Canada.
Nous remercions tous les candidats intéressés, seulement les personnes sélectionnées pour les étapes suivantes seront contactées."
Graduate Studies Coordinator - MMSc Programs,University of Waterloo,"Waterloo, ON",https://ca.indeed.com/rc/clk?jk=d6107cb1211f7d0c&bb=lCZQMjBWQa_JJl2FE87EedJOpD2yfBvRLK6HOCF-TOTe9IVqb3u-6ZsQwWtAXdySBoGxK87-2g5VxA82FXxukTN7B7jrb3-Odb3LVp3rF0w5mFQDv0zA78gw385BTWKa&xkcb=SoDU67M3nQZGiNwrAh0NbzkdCdPP&fccid=5bcffa6277080afe&vjs=3,"At the University of Waterloo, we create and promote a culture where everyone can reach their full potential. As an employee, you get support & opportunities that empower you to advance your career. Explore how we can bring big ideas to life, together. The University is a welcoming workplace for those of all abilities, interests, and expertise. As part of our workforce, you can do what you do best, every day.

Learn more about our recruitment process.

Job Requisition ID:
2026-00028

Time Type:
Full time
Employee Group:
Staff
Job Category:
Academic Administration
Employment Type:
Permanent
Department:
Faculty of Engineering - Management Science and Engineering - Administration
Hiring Range:
$50,006.31 - $62,507.89
Posting Information:
This posting is for an existing vacancy
The internal posting deadline for this position is Thursday, January 29, 2026, at 11:59PM.
Job Description:
Primary Purpose
The Graduate Studies Coordinator – MMSc Programs is responsible for the administration of all Management Sciences and Engineering MMSc on-campus (including the Graduate Diploma in Data Analytics (GDDA)) and on-line programs, as well as exchange and non-degree students. This position has a high level of responsibility to meet the demands associated with the programs. The Coordinator must be knowledgeable in graduate policy and procedures and able to assist graduate students throughout their graduate program to ensure compliance with all academic regulations. The Coordinator also provides recommendations to faculty advisors regarding resolution of problems. As well as provides assistance to the Associate Chair for Graduate Studies and the Director, MMSc Online programs.
The Coordinator is a key component to the graduate student experience. The Coordinator must have an appreciation for the diverse cross-cultural backgrounds of the department’s student body.
Key Accountabilities
Academic Advising and Student Support for MMSc Students (including GDDA, exchange and non-degree students):
Provide guidance on admissions, academic progression, degree requirements, diploma requirements, course selection, drop/adds, INC marks, program extensions, confirmation of degree requirements and convocation procedures;
Advise students and faculty about the graduate programs, calendar changes, minimum program requirements, and relevant University of Waterloo policies and procedures;
Investigate and trouble-shoot inquiries on behalf of students who require accommodations or non-standard arrangements;
Interpret and apply university regulations, and Faculty/department policies and procedures as they apply to the department’s graduate programs to help resolve issues;
Work with the Associate Chair, Graduate Studies and graduate students who are experiencing difficulties to resolve issues.This may include preparation of documentation regarding cases of academic dishonesty, student appeals/petitions, etc.
Provide advice and assistance to students on academic issues that may result in negative academic decisions, such as continuation in program or withdrawal from program.
Assist non-Canadian students with their transition to Waterloo.
Graduate Program Administration for MMSc Students (including GDDA, exchange and non-degree students):
Maintain student records from admission to convocation;
Ensure admission requirements and deadlines are being met; Liaises with Graduate Studies and Post-Doctoral Affairs (GSPA) and Engineering Graduate Studies Office (EGSO)
Review student grades and records for academic progression each term to ensure department/Faculty/University requirements are being met;
Identify academic progression issues, determine appropriate action and recommend academic decision and outcomes to Associate Chair for Graduate Studies;
Consult with the Associate Chair for Graduate Studies to resolve more complex issues;
Ensure faculty and students are notified of relevant program information, events, requirements, changes, etc.;
Responsible for maintaining confidentiality and security of student academic records as per FIPPA guidelines and University policies;
Graduate Coop Program Coordinator
Notifies students of MSCI Coop program. Organizes an information session each year.
Advises students regarding the application process, eligibility requirements, rules and regulations, and appropriate deadlines;
Reviews applications for completion and evaluates student eligibility;
Prepares summaries for the Associate Chair Graduate Studies to support the decision process;
Documents decisions and official comments associated with each candidate’s application;
Distributes results to GSPA and Coop office;
Informs students of Work Term report deadlines and collects Work Term reports for distribution to the Work Term Report Marker.
Keeps informed of Coop guidelines and criteria, and updates internal due dates and procedures;
Ensures Coop guidelines are adhered to.
Other
Acts as back up to the Graduate Studies Administrator – PhD and MASc Programs;
Assists with orientation activities, departmental information sessions, and other graduate student related events (ie, ExpecTAtions, 3 Minute Thesis, Graduate Awards Ceremony);
Updates and maintains MMSc student records and graduate student database (Filemaker);
Maintain the MMSc LEARN site.Update program specific information, monitor issues and questions that arise;
Monitor the term course offerings on MMSc On-line courses to ensure correct courses are being offered. Bring possible issues to the attention of the Administrative Officer and/or the Director, MMSc Online programs;
Confirm TA applicant eligibility as requested each term by the Associate Chair, Undergraduate Studies for all MMSc students;
Monitor the Department Website information for the MMSc programs and other graduate related business and provide updated information to the Department Website Content Manager;
Maintain the MSCI graduate student email list (for all MMSC on-campus students) mansci_MMSCstudents@lists.uwaterloo.ca . Regularly provide updated listing to the Systems Administrator;
Identify and recommend process improvements;
Attend Graduate Recruitment events when required;
Attend meetings and update skills as deemed necessary for this position;
Provides support to periodic internal and external graduate program reviews;
Provides back up to other staff as required;
Maintain procedure manuals for this position and implements changes to procedures and processes as directed by the Department, Faculty or University;
Other duties or projects as assigned by the Administrative Officer.
Required Qualifications
Education
College Diploma in Office Administration or related discipline.Equivalent combination of education and/or experience will be considered.
Experience
Demonstrated administrative experience is required, experience in an academic work environment is preferred. Student advising experience and/or scholarship management preferred.
Knowledge/Skills/Abilities
Comprehensive understanding of university policies and procedures as they relate to graduate studies is strongly preferred;
Organizational, analytical, interpersonal, customer service and strong communication skills (oral and written) required;
Aptitude for attention to detail and accuracy are required;
Proven capacity to handle high volume of requests and multi-task;
Intermediate skills in MS Word, Excel, PowerPoint, Outlook, Sharepoint, Filemaker Pro, WCMS, Quest, LEARN and OnBase an asset;
Ability to learn and adapt to specialized software and systems at the University;
Ability to set priorities and remain organized while managing multiple priorities with a high level of accuracy and attention to detail, with minimum supervision.
Excellent written and verbal communication skills and the ability to work with a diverse student body in a cross-cultural environment;
Demonstrated advising skills with the ability to support students through difficult situations.
Equity Statement

The University of Waterloo acknowledges that much of our work takes place on the traditional territory of the Neutral, Anishinaabeg, and Haudenosaunee peoples. Our main campus is situated on the Haldimand Tract, the land granted to the Six Nations that includes six miles on each side of the Grand River. Our active work toward reconciliation takes place across our campuses through research, learning, teaching, and community building, and is coordinated within the Office of Indigenous Relations.

The University values the diverse and intersectional identities of its students, faculty, and staff. The University regards equity and diversity as an integral part of academic excellence and is committed to accessibility for all employees. The University of Waterloo seeks applicants who embrace our values of equity, anti-racism and inclusion. As such, we encourage applications from candidates who have been historically disadvantaged and marginalized, including applicants who identify as First Nations, Métis and/or Inuk (Inuit), Black, racialized, a person with a disability, women and/or 2SLGBTQ+.

Positions are open to qualified candidates who are legally entitled to work in Canada.

The University of Waterloo is committed to accessibility for persons with disabilities. If you have any application, interview, or workplace accommodation requests, please contact Human Resources at hrhelp@uwaterloo.ca or 519-888-4567, ext. 45935."
