title,company,location,link,description
Integration Tools Developer Coop/Intern,Ericsson,"Ottawa, ON",https://ca.indeed.com/rc/clk?jk=f7b44d3e916e50e6&bb=1hgZPPRWVA4bJVbazRKb62C2ycRBDbOGmD8XKvlAUAB_fgFwgpXOFiZRz41fYBvatkB-9jhDlJ9IyTK1ngtOYMUcQs-4O1fMBAZ3KLYoFzoWEof7nP_-N9nnqUvNcXwW&xkcb=SoDb67M3nQZNavynMZ0HbzkdCdPP&fccid=82656d64a9a3e6a7&vjs=3,"Join our Team
Position: Integration Tools Developer Coop/Intern
Location: Ottawa, Ontario
Duration: 16 months (for co-ops) | 8 months+ (for interns, with potential for extension)
Start Date: May 4th, 2026

Accepting applications until Feb 20th or until filled.
Upload an unofficial copy of your transcript

At this time, Ericsson Canada Inc. does not provide immigration assistance/sponsorship now or in the future for this position.

About this opportunity:
The Ericsson Radio Product Team is responsible for all aspects of development for the next generation of wireless base stations: systemization, design, integration, and verification of multi-standard radios to create new capabilities and satisfy customer needs.
Candidates can expect an onsite and hands-on technical role where you will gain real-world and practical engineering experience in an R&D department.
If you are selected for this position, you will work as part of the Radio Product Integration team, which combines hardware and software designs to validate the functionality and performance of new radio products.
The product integration team features extensive access to radio-frequency lab equipment, training, resources, and will give a true sense of what it’s like to work for a large, leading edge technology company.

What you will do:
Work tasks will include some or all of the following (depending on the work assignment):
Be involved in the full-stack development of testing and analytics software
Use Machine Learning techniques to classify failure cases, create clusters, and to add intelligence to the integration tools
Work in a tight collaborative group focused on testing and troubleshooting new hardware/software Radio designs to come up with the parameters that are suitable for the given product and to validate that the overall product can meet its functional and performance requirements
Prepare lab environment including both hardware and software components
Connect multiple digital & analog radio frequency (RF) designs into a product prototype
Be responsible for the functional and performance integration of new products
Develop calibration and performance optimization procedures
Define test coverage required for product integration
Implement test automation and validation methods using scripting in python or MATLAB
Analyze results, drive product design updates, identify potential system design shortcomings, and report findings
Perform statistical analysis of measurement data
The skills you bring:
Student in a B.Sc., B.A.Sc., B.Eng., B.Tech. or their Master equivalent programs specialized in Computer Engineering, Computer Science, Electrical Engineering, Mechatronics Engineering, Electronics and Telecommunications Engineering or a related field.
2.7+ GPA on a 4.0 scale or equivalent
Actively enrolled in an accredited undergraduate or Master’s on a full-time basis at a 4-year college or university at the time of the internship
Be available to work 40 hours per week during the summer or Co-Op term
Familiarity with Object-Oriented Programming (OOP) principles
Good understanding of any modern language: Python/C#/C++. While we don't expect mastery, the ability to write and understand code is important
A keen interest in web development. Any exposure to React is a significant plus
Basic understanding and experience with Git for version control
Basic knowledge of Linux and its command-line interface
Eagerness to learn and apply new software development skills in a practical setting
Strong problem solving and analytical skills
Strong team and interpersonal skills
Energy and drive to thrive in a dynamic product development environment
Proficient English skills, both written and spoken
Other useful skills:
Experience with basic lab equipment including spectrum analyzers, network analyzers, signal generators, oscilloscopes, multimeters, and power supplies
Basic knowledge of wireless communication standards
Understanding of analog/digital hardware building blocks
Why join Ericsson?
At Ericsson, you´ll have an outstanding opportunity. The chance to use your skills and imagination to push the boundaries of what´s possible. To build solutions never seen before to some of the world’s toughest problems. You´ll be challenged, but you won’t be alone. You´ll be joining a team of diverse innovators, all driven to go beyond the status quo to craft what comes next.

What happens once you apply?
Click Here to find all you need to know about what our typical hiring process looks like.

Ericsson uses a merit-based hiring approach that values people with different experiences, perspectives and skillsets. We truly believe this approach drives innovation, which is essential for our future growth. We encourage people from all backgrounds to apply and realize their full potential as part of our Ericsson team. Ericsson is proud to be an Equal Opportunity employer, learn more.

If you need assistance or to request an accommodation due to a disability, please contact Ericsson at hr.direct.americas@ericsson.com.

DISCLAIMER: The above statements are intended to describe the general nature and level of work being performed by employees in this position. They are not an exhaustive list of all responsibilities, duties and skills required for this position, and you may be required to perform additional job tasks as assigned.

Primary country and city: Canada (CA) || Ottawa (Country/ City)

Job details: Developer

Compensation and Benefits at Ericsson
At Ericsson, we know that our people are the key to our success. We offer a competitive package to help with your individual needs and goals.

Your Pay
The salary offered is dependent on various factors including, but not limited to, location, and the candidate’s combination of job-related knowledge, qualifications, skills, education, training, and experience.

The salary range for this position is
Ontario:
Bachelors $25.50-34.50/hr CAD
Masters 37/hr CAD"
Systems Analyst,Harris Computer Systems,Ontario,https://ca.indeed.com/rc/clk?jk=49b8ea046bb32441&bb=1hgZPPRWVA4bJVbazRKb69sRO0AjEMo5Vn_8KWPWktnUkVxi0ihKhQYPMqtN1Qj6yUY_xP52GUxr-BNFrRqw1LAGupcV348uawQiOPHkSQm4iYjBxm9wFOvf-sHDAxdm&xkcb=SoBv67M3nQZNavynMZ0GbzkdCdPP&fccid=c7a4f45e467435a8&vjs=3,"Who You Are
You’re enrolled in a coop program in Business Information Systems, Computer Engineering, CS or something similar—and you’re itching to roll up your sleeves in the world of Large Language Models. You love digging into data, tinkering with scripts and experimenting until things click.
What You’ll Do
Build intelligent agents that connect data silos via MCP, enabling LLMs to provide more accurate, context-aware insights
Dive into our our AI chatbot by refining prompts, running A/B tests and slashing hallucinations
Audit & cleanup knowledgebase articles so our LLM learns from only the best data
Tag, categorize & structure unstructured content (docs, FAQs, PDFs) for better retrieval
Build simple scripts (Python, PowerShell) to automate data prep or streamline workflows
Measure & iterate on model outputs—track accuracy, relevance and speed, then recommend tweaks
Collaborate with stakeholders to gather and understand requirements
Evaluate source content against AI outputs, identify any discrepancies, and flag them for correction to ensure our data stays accurate and reliable
What We’re Looking For
Current coop student in BIS, CE, CS or related field
Comfortable with Word, Excel and SQL and eager to learn more
Basic Python (or another scripting language) skills
A genuine curiosity about AI/LLMs and prompt engineering
Why You’ll Love It Here
Real impact: Your work goes straight into production
Mentorship: Regular checkins and learning sessions with seasoned pros
Flexibility: Fully remote, adjustable hours to fit your schedule
Growth: Exposure to cross-functional teams in IT and product
Hourly: $25
About Harris
Harris powers missioncritical software for North American publicsector clients—utilities, local government, schools, public safety and healthcare. As part of Constellation Software Inc. (TSX: CSU), we grow by reinvesting in our people, products and strategic acquisitions.
*Only successful candidates will be contacted*.
Harris is an Equal Opportunity Employer and members of the following targeted groups are encouraged to apply women, persons with disabilities, aboriginal peoples and visible minorities. If you are a person with a disability, assistance with the screening and selection process is available on request.
The Harris Talent Acquisition team does not use text messages to contact candidates or solicit confidential information. We encourage all candidates to apply for advertised positions. They will be contacted either by a Harris manager or by a member of the Talent Acquisition team for an interview, once the required criteria have been met."
RF Integration Coop/Intern,Ericsson,"Ottawa, ON",https://ca.indeed.com/rc/clk?jk=d9d5adcc69e65a97&bb=1hgZPPRWVA4bJVbazRKb61WWI3PTIJlzo6rk20RPnlIW1m6W2Wk1fRJWYganm7XvfSG3NE0NtVE-wMnvNWkXRjfJi78BkjVHjSMFwXjISxn3T_tQSEymw1N-VfDhK548&xkcb=SoDy67M3nQZNavynMZ0FbzkdCdPP&fccid=82656d64a9a3e6a7&vjs=3,"Join our Team
Position: RF Integration Coop/Intern
Location: Ottawa, Ontario
Duration: 16 months (for co-ops) | 8 months+ (for interns, with potential for extension)
Start Date: May 4th, 2026

Accepting applications until Feb 20th or until filled.

Upload an unofficial copy of your transcript

At this time, Ericsson Canada Inc. does not provide immigration assistance/sponsorship now or in the future for this position.

About this opportunity:
The Ericsson Radio Product Team is responsible for all aspects of development for the next generation of wireless base stations: systemization, design, integration, and verification of multi-standard radios to create new capabilities and satisfy customer needs.
Candidates can expect an onsite and hands-on technical role where you will gain real-world and practical engineering experience in an R&D department.
If you are selected for this position, you will work as part of the Radio Product Integration team, which combines hardware and software designs to validate the functionality and performance of new radio products.
The product integration team features extensive access to radio-frequency lab equipment, training, resources, and will give a true sense of what it’s like to work for a large, leading edge technology company.

What you will do:
Work tasks will include some or all of the following (depending on the work assignment)
Work in a tight collaborative group focused on testing and troubleshooting new hardware/software Radio designs to come up with the parameters that are suitable for the given product and to validate that the overall product can meet its functional and performance requirements
Prepare lab environment including both hardware and software components
Connect multiple digital & analog radio frequency (RF) designs into a product prototype
Be responsible for the functional and performance integration of new products
Develop calibration and performance optimization procedures
Define test coverage required for product integration
Implement test automation and validation methods using scripting in python or MATLAB
Analyze results, drive product design updates, identify potential system design shortcomings, and report findings
Perform statistical analysis of measurement data

The skills you bring:
Student in a B.Sc., B.A.Sc., B.Eng., B.Tech. or their Master equivalent programs specialized in Computer Engineering, Electrical Engineering, Mechatronics Engineering, Electronics and Telecommunications Engineering or a related field.
2.7+ GPA on a 4.0 scale or equivalent
Actively enrolled in an accredited undergraduate, Master’s, on a full-time basis at a 4-year college or university at the time of the internship
Be available to work 40 hours per week during the summer or Co-Op term
Strong problem solving and analytical skills
Strong team and interpersonal skills
Strong object-oriented programming skills (Python, C++ an asset)
Scripting skills in MATLAB are an asset
RF Engineering skills are an asset
Energy and drive to thrive in a dynamic product development environment
Proficient English skills, both written and spoken
Other useful skills:
Experience with basic lab equipment including: spectrum analyzers, network analyzers, signal generators, oscilloscopes, multimeters, and power supplies
Basic knowledge of wireless communication standards
Understanding of analog/digital hardware building blocks

Why join Ericsson?
At Ericsson, you´ll have an outstanding opportunity. The chance to use your skills and imagination to push the boundaries of what´s possible. To build solutions never seen before to some of the world’s toughest problems. You´ll be challenged, but you won’t be alone. You´ll be joining a team of diverse innovators, all driven to go beyond the status quo to craft what comes next.

What happens once you apply?
Click Here to find all you need to know about what our typical hiring process looks like.

Ericsson uses a merit-based hiring approach that values people with different experiences, perspectives and skillsets. We truly believe this approach drives innovation, which is essential for our future growth. We encourage people from all backgrounds to apply and realize their full potential as part of our Ericsson team. Ericsson is proud to be an Equal Opportunity employer, learn more.

If you need assistance or to request an accommodation due to a disability, please contact Ericsson at hr.direct.americas@ericsson.com.

DISCLAIMER: The above statements are intended to describe the general nature and level of work being performed by employees in this position. They are not an exhaustive list of all responsibilities, duties and skills required for this position, and you may be required to perform additional job tasks as assigned.

Primary country and city: Canada (CA) || Ottawa (Country/ City)

Job details: Developer

Compensation and Benefits at Ericsson
At Ericsson, we know that our people are the key to our success. We offer a competitive package to help with your individual needs and goals.

Your Pay
The salary offered is dependent on various factors including, but not limited to, location, and the candidate’s combination of job-related knowledge, qualifications, skills, education, training, and experience.
The salary range for this position is
Ontario:
Bachelors $25.50-34.50/hr CAD
Masters 37/hr CAD"
"COOP Student, Traffic Engineering",City of Ottawa,"Ottawa, ON",https://ca.indeed.com/rc/clk?jk=d3a2b632300f2406&bb=AGXUG7u2TxJp1DP2DCPrF7scYq-4AmJj7Zw-eIu0lrOV2hz3AL1-ukKCuEqRV7gqpbPQqgj_gLFV6r0y2wH5ZTA0-cjqVAYf47EZ7iSxL5N1nTziW9bEbGex4oFM12N0&xkcb=SoD-67M3nQZKDOR-kZ0LbzkdCdPP&fccid=06f0c906048a9394&vjs=3,"Requisition ID: 20393
Department: Public Works Dept.
Service: Traffic Services
Branch: Traffic Operations Branch
Employment Type: 1 Co-op Student - Up to 4 months; May 2026 - August 2026
Work Hours: 35.00 hours per week
Affiliation: Non Union/Non MPE
Salary Information: $26.982 - $31.566 per hour (2024 rates of pay)
Location: 175 Loretta Street
City: Ottawa, ON
Job Category: Co-op student recruitment
Application Close: 20/02/2026
To be considered for this competition you must be enrolled in a registered co-op program at a Canadian post-secondary institution, and eligible for a Work Term during the specified period. Students must upload proof of enrolment in a co-op program when completing your application.
JOB SUMMARY
This job is exclusively for Coop Students who are enrolled in a recognized post-secondary co-operative education program in Civil, Transportation or Computer studies and are in their 3rd or 4th year of studies.

The City of Ottawa Traffic Operations Division is responsible for the design, installation, operation and maintenance of over 1200 signalized intersections. One (1) co-op student is needed to assist the Traffic Engineering Unit staff in performing a broad range of functions related to Traffic Engineering studies, including but not limited to filed studies, technical support, analysis and reporting. During the work term you will:
1. Gain working experience in traffic engineering and traffic control signal operations.
2. Learn the structure of the City of Ottawa Traffic Control Signal System.
3. Obtain practical analytical and planning skills and software applications.
4. Improve your interpersonal skills in a dynamic project environment.

This role is ideal for an individual who has a passion for transportation and technology, with interest in work with a leading municipality in the intelligent transportation systems (ITS) and traffic control technologies. We're looking for a self-starter with a positive attitude and willingness to learn. This opportunity will allow you take on new challenges while working on a wide variety of traffic engineering projects.

Key Duties
Perform standard traffic engineering field studies such as Queuing Studies, Delay Studies, Travel Time Runs and Volume Counts to evaluate traffic signal timing and phasing operations, traffic incident management and observing traffic patterns.
Investigate complaints about traffic signal timing and phasing and make recommendations for their resolution.
Using various computerized tools such as Synchro, conduct analysis of traffic data.
Prepare written reports summarizing field traffic data, containing recommendations based on the results.
Prepare specific signal timing related databases extracted from the City's central traffic control computer.
Assist in the preparation, evaluating of data required by the local traffic signal controllers.
Assist in conducting capacity analysis to evaluate the operation of anticipated changes in traffic patterns or proposed changes to the new City of Ottawa road network.

Personal Suitability
Interact professionally with staff/colleagues, and the general public
Able to demonstrate sound judgement and decision-making capabilities
Able to think analytically, and be attentive to accuracy and detail
Display strong leadership skills, initiative, enthusiasm, and work ethic
Possess a work record of good attendance and job performance
EDUCATION AND EXPERIENCE
Enrolment in a recognized co-operative engineering program in Civil, Transportation or Computer studies and are in their 3rd or 4th year of studies.
Knowledge in traffic engineering, and previous work experience in Civil/Transportation Engineering is an asset.
No Experience is required but a knowledge in traffic engineering, and previous work experience in Civil/Transportation Engineering is an asset.
COMPETENCIES, SKILLS AND ABILITIES
MS Office including Excel and Word
Analytical and research techniques
Attention to detail
Flexible
Dependable
WHAT YOU NEED TO KNOW
Language Requirement: English oral, reading, writing
Driver’s License Requirement: A valid Ontario unrestricted G class driver’s license (or provincial equivalent) with no more than 6 demerit points accumulated; This position requires the successful candidate to use their own transportation.
Green patch safety boots are required.
Please save a copy of the job poster. Once the closing date has passed, it will no longer be available.

We wish to thank all applicants for their interest and effort in applying for this position. Only candidates selected for interviews will be contacted.

The City of Ottawa promotes the principles of diversity and inclusion and adheres to the tenets of the Canadian Human Rights Act and the Ontario Human Rights Code. We encourage applications from members of Indigenous, Black and other racialized communities, persons with disabilities, women and non-binary persons, persons of all ethnic origins, religions, sexual orientations, classes, gender identities and expressions.
Candidates are encouraged to self-identify as a member of one or more designated employment equity groups in the self-identification questionnaire.

The City of Ottawa provides accommodation to applicants during all parts of the hiring process, upon request. If contacted to proceed to the selection process, please advise us if you require any accommodation.

Accessible formats and communication supports are available upon request. Please contact the Employee Service Centre at 613-580-2424 extension 12211 or via email at esc-cse@ottawa.ca."
COOP Student Heritage Planning,City of Ottawa,"Ottawa, ON",https://ca.indeed.com/rc/clk?jk=16e1e205e8adf430&bb=AGXUG7u2TxJp1DP2DCPrFxnXeqV3ZJBcFtVsBgtSHNAqTRh8ozfLQjgZL3fK-WciVFqo4r_HrjZ-8ythUZPR9kCIc_e2AK6QI1vplEYWA7cJ8iwU2YWF7BShjiAQZ-Nz&xkcb=SoBK67M3nQZKDOR-kZ0KbzkdCdPP&fccid=06f0c906048a9394&vjs=3,"Requisition ID: 20652
Department: Planning, Development & Building Dept.
Service: ROW, Heritage & Urban Dsgn Services
Branch: Heritage Planning Branch
Employment Type: 1 Co-op Placement - Summer Term
Work Hours: 35 hours per week
Affiliation: Non Union/Non MPE
Salary Information: $26.982 - $31.566 per hour (2024 rates of pay)
Location: City Hall,110 Laurier Avenue West
City: Ottawa, ON
Job Category: Co-op student recruitment
Application Close: 06/02/2026

To be considered for this competition you must be enrolled in a registered co-op program at a Canadian post-secondary institution, and eligible for a Work Term during the specified period. Students must upload proof of enrolment in a co-op program when completing your application.
JOB SUMMARY

This job is exclusively for Coop Students who are enrolled in a recognized post-secondary co-operative education program.

The Planning, Development, and Building department is responsible for the planning and delivery of growth activities, including long range land use planning, the City’s long-term infrastructure plan, the management of capital investments, development approvals, delivering on major city-building projects and identifying opportunities to foster economic prosperity.

You are responsible for performing various activities associated with the support of planning activities, including conducting surveys, research, data analysis, and preparing documents.

In the Heritage Planning branch this job includes:
Assisting in processing certain types of applications under the Ontario Heritage Act such as alterations and additions to designated heritage buildings;
Conducting research and analysis on heritage buildings to assist with heritage planning projects such as the designation of individual properties or heritage conservation districts;
Supporting heritage planners with the preparation of materials for public meetings and public outreach events;
Conducting site visits, site analysis and photo documentation.
EDUCATION AND EXPERIENCE

Enrolment in a recognized co-operative education program in one of the following:engineering, urban planning, environmental studies, computer science or related field

No experience required
KNOWLEDGE
Familiarity with general land use planning principles
Knowledge of word processing, spread sheets, GIS, interpreting air photos and maps, and a familiarity with reading plans
COMPETENCIES, SKILLS AND ABILITIES
Analytical and research techniques
Ability to work both independently and as a member of a team, and to quickly adjust from one project to another
Attention to detail
MS Office
Flexible
Dependable
WHAT YOU NEED TO KNOW
Language Requirement: English oral, reading, writing
Please save a copy of the job poster. Once the closing date has passed, it will no longer be available.

We wish to thank all applicants for their interest and effort in applying for this position. Only candidates selected for interviews will be contacted.

The City of Ottawa promotes the principles of diversity and inclusion and adheres to the tenets of the Canadian Human Rights Act and the Ontario Human Rights Code. We encourage applications from members of Indigenous, Black and other racialized communities, persons with disabilities, women and non-binary persons, persons of all ethnic origins, religions, sexual orientations, classes, gender identities and expressions.
Candidates are encouraged to self-identify as a member of one or more designated employment equity groups in the self-identification questionnaire.

The City of Ottawa provides accommodation to applicants during all parts of the hiring process, upon request. If contacted to proceed to the selection process, please advise us if you require any accommodation.

Accessible formats and communication supports are available upon request. Please contact the Employee Service Centre at 613-580-2424 extension 12211 or via email at esc-cse@ottawa.ca."
